{
  "$schema": "https://json-schema.org/draft/2020-12/schema",
  "$id": "https://github.com/equinor/powerplatform/plugin-review.schema.json",
  "title": "Equinor Power Platform Plugin Review",
  "type": "object",
  "additionalProperties": false,
  "required": [
    "pluginName",
    "reviewDate",
    "reviewer",
    "publicationStatus",
    "ownership",
    "scope",
    "skillAndScriptSafety",
    "mcp",
    "powerPlatformGovernance",
    "technologyRadar",
    "designSystem",
    "publication",
    "blockers",
    "evidence"
  ],
  "properties": {
    "pluginName": {
      "type": "string",
      "pattern": "^[a-z0-9][a-z0-9-]{0,63}$"
    },
    "reviewDate": {
      "type": "string",
      "format": "date"
    },
    "reviewer": {
      "type": "string",
      "minLength": 1
    },
    "publicationStatus": {
      "type": "string",
      "enum": [
        "not-reviewed",
        "defer",
        "controlled-pilot",
        "ready-for-internal-pilot",
        "published"
      ]
    },
    "ownership": {
      "type": "object",
      "additionalProperties": false,
      "required": [
        "owner",
        "supportChannel",
        "upstreamSource",
        "upstreamVersion"
      ],
      "properties": {
        "owner": {
          "type": "string"
        },
        "supportChannel": {
          "type": "string"
        },
        "upstreamSource": {
          "type": "string"
        },
        "upstreamVersion": {
          "type": "string"
        }
      }
    },
    "scope": {
      "type": "object",
      "additionalProperties": false,
      "required": [
        "summary",
        "createsOrModifiesAssets",
        "deploysAssets",
        "deletesAssets",
        "productionInteractionDefault"
      ],
      "properties": {
        "summary": {
          "type": "string"
        },
        "createsOrModifiesAssets": {
          "type": "boolean"
        },
        "deploysAssets": {
          "type": "boolean"
        },
        "deletesAssets": {
          "type": "boolean"
        },
        "productionInteractionDefault": {
          "type": "boolean"
        }
      }
    },
    "skillAndScriptSafety": {
      "type": "object",
      "additionalProperties": false,
      "required": [
        "skillsReviewed",
        "agentsReviewed",
        "hooksReviewed",
        "scriptsReviewed",
        "bundledScripts",
        "secretsEmbedded",
        "externalNetworkCalls"
      ],
      "properties": {
        "skillsReviewed": {
          "type": "boolean"
        },
        "agentsReviewed": {
          "type": "boolean"
        },
        "hooksReviewed": {
          "type": "boolean"
        },
        "scriptsReviewed": {
          "type": "boolean"
        },
        "bundledScripts": {
          "type": "array",
          "items": {
            "$ref": "#/$defs/scriptReview"
          }
        },
        "secretsEmbedded": {
          "type": "boolean"
        },
        "externalNetworkCalls": {
          "type": "array",
          "items": {
            "type": "string"
          }
        }
      }
    },
    "mcp": {
      "type": "object",
      "additionalProperties": false,
      "required": [
        "required",
        "servers",
        "versionsPinned",
        "approvedAccessRequired",
        "productionInteractionBlocked"
      ],
      "properties": {
        "required": {
          "type": "boolean"
        },
        "servers": {
          "type": "array",
          "items": {
            "$ref": "#/$defs/mcpServer"
          }
        },
        "versionsPinned": {
          "type": "boolean"
        },
        "approvedAccessRequired": {
          "type": "boolean"
        },
        "productionInteractionBlocked": {
          "type": "boolean"
        }
      }
    },
    "powerPlatformGovernance": {
      "type": "object",
      "additionalProperties": false,
      "required": [
        "assumedZone",
        "intendedUsers",
        "dataClassificationCeiling",
        "confidentialDataSupported",
        "dependencies",
        "architectureContractRequired",
        "ciRequired"
      ],
      "properties": {
        "assumedZone": {
          "type": "string",
          "description": "The assumed Power Platform zone. Defaults to red since GitHub Copilot users are developers operating in the red zone.",
          "enum": [
            "green",
            "yellow",
            "red",
            "not-applicable"
          ]
        },
        "intendedUsers": {
          "type": "array",
          "items": {
            "type": "string",
            "enum": [
              "personal-maker",
              "certified-citizen-developer",
              "certified-citizen-agent-creator",
              "professional-it-developer",
              "platform-team",
              "not-assessed",
              "other"
            ]
          }
        },
        "dataClassificationCeiling": {
          "type": "string",
          "description": "Highest WR0158 information classification the solutions produced with this plugin may handle. It does not describe the plugin's own content, which is OPEN because this repository is public.",
          "enum": [
            "open",
            "equinor-internal",
            "equinor-restricted",
            "equinor-confidential",
            "not-assessed"
          ]
        },
        "confidentialDataSupported": {
          "type": "boolean"
        },
        "dependencies": {
          "type": "array",
          "description": "Platform, environment, and developer dependencies that affect plugin usability. Replaces connector/DLP-focused fields since those are situational and environment-specific.",
          "items": {
            "$ref": "#/$defs/dependency"
          }
        },
        "architectureContractRequired": {
          "type": "boolean"
        },
        "ciRequired": {
          "type": "boolean"
        }
      }
    },
    "technologyRadar": {
      "type": "object",
      "additionalProperties": false,
      "required": [
        "technologies",
        "hasHoldTechnology",
        "hasAssessTechnology",
        "hasUnknownTechnology"
      ],
      "properties": {
        "technologies": {
          "type": "array",
          "items": {
            "$ref": "#/$defs/technologyReview"
          }
        },
        "hasHoldTechnology": {
          "type": "boolean"
        },
        "hasAssessTechnology": {
          "type": "boolean"
        },
        "hasUnknownTechnology": {
          "type": "boolean"
        }
      }
    },
    "designSystem": {
      "type": "object",
      "additionalProperties": false,
      "required": [
        "generatesFrontend",
        "edsRequired",
        "edsPackages",
        "exceptions"
      ],
      "properties": {
        "generatesFrontend": {
          "type": "boolean"
        },
        "edsRequired": {
          "type": "boolean"
        },
        "edsPackages": {
          "type": "array",
          "items": {
            "type": "string"
          }
        },
        "exceptions": {
          "type": "array",
          "items": {
            "type": "string"
          }
        }
      }
    },
    "publication": {
      "type": "object",
      "additionalProperties": false,
      "required": [
        "targetRepository",
        "copilotManifest",
        "claudeManifest",
        "versionsSynchronized",
        "variaCatalogRequired",
        "techDocsRequired",
        "architectureContractLinkRequired",
        "installTested",
        "rollbackDocumented"
      ],
      "properties": {
        "targetRepository": {
          "type": "string"
        },
        "copilotManifest": {
          "type": "boolean"
        },
        "claudeManifest": {
          "type": "boolean"
        },
        "versionsSynchronized": {
          "type": "boolean"
        },
        "variaCatalogRequired": {
          "type": "boolean"
        },
        "techDocsRequired": {
          "type": "boolean"
        },
        "architectureContractLinkRequired": {
          "type": "boolean"
        },
        "installTested": {
          "type": "boolean"
        },
        "rollbackDocumented": {
          "type": "boolean"
        }
      }
    },
    "blockers": {
      "type": "array",
      "items": {
        "type": "string"
      }
    },
    "evidence": {
      "type": "array",
      "items": {
        "$ref": "#/$defs/evidenceItem"
      }
    },
    "notes": {
      "type": "string"
    }
  },
  "$defs": {
    "scriptReview": {
      "type": "object",
      "additionalProperties": false,
      "required": [
        "path",
        "purpose",
        "reviewed",
        "externalCommands",
        "networkAccess",
        "secretAccess"
      ],
      "properties": {
        "path": {
          "type": "string"
        },
        "purpose": {
          "type": "string"
        },
        "reviewed": {
          "type": "boolean"
        },
        "externalCommands": {
          "type": "array",
          "items": {
            "type": "string"
          }
        },
        "networkAccess": {
          "type": "boolean"
        },
        "secretAccess": {
          "type": "boolean"
        }
      }
    },
    "mcpServer": {
      "type": "object",
      "additionalProperties": false,
      "required": [
        "name",
        "transport",
        "version",
        "purpose"
      ],
      "properties": {
        "name": {
          "type": "string"
        },
        "transport": {
          "type": "string",
          "enum": [
            "stdio",
            "http",
            "sse",
            "not-assessed"
          ]
        },
        "version": {
          "type": "string"
        },
        "purpose": {
          "type": "string"
        }
      }
    },
    "dependency": {
      "type": "object",
      "additionalProperties": false,
      "required": [
        "name",
        "category",
        "description",
        "blocking"
      ],
      "properties": {
        "name": {
          "type": "string"
        },
        "category": {
          "type": "string",
          "enum": [
            "environment-setting",
            "dlp-policy",
            "developer-prerequisite",
            "platform-feature",
            "license",
            "access-role"
          ]
        },
        "description": {
          "type": "string"
        },
        "blocking": {
          "type": "boolean",
          "description": "Whether this dependency is a hard blocker for plugin use if not satisfied."
        }
      }
    },
    "technologyReview": {
      "type": "object",
      "additionalProperties": false,
      "required": [
        "name",
        "radarState",
        "usedFor",
        "source"
      ],
      "properties": {
        "name": {
          "type": "string"
        },
        "radarState": {
          "type": "string",
          "enum": [
            "Hold",
            "Assess",
            "Trial",
            "Adopt",
            "unknown",
            "not-applicable"
          ]
        },
        "usedFor": {
          "type": "string"
        },
        "source": {
          "type": "string"
        }
      }
    },
    "evidenceItem": {
      "type": "object",
      "additionalProperties": false,
      "required": [
        "type",
        "reference",
        "summary"
      ],
      "properties": {
        "type": {
          "type": "string",
          "enum": [
            "file",
            "command",
            "manual-review",
            "external-source"
          ]
        },
        "reference": {
          "type": "string"
        },
        "summary": {
          "type": "string"
        }
      }
    }
  }
}